{
  "$schema": "https://raw.githubusercontent.com/niansia/ContextSec/v0.4.0/benchmarks/holdout-predictions.schema.json",
  "version": "0.4-protocol-3",
  "status": "template",
  "tool": {
    "tool_version": "0.0.0",
    "schema_version": "0.0.0",
    "detector_version": "0.0.0",
    "checker_version": "0.0.0",
    "git_commit": "0000000000000000000000000000000000000000",
    "detector_model_digest": "sha256:0000000000000000000000000000000000000000000000000000000000000000",
    "routing_model_digest": "sha256:0000000000000000000000000000000000000000000000000000000000000000",
    "checker_model_digest": "sha256:0000000000000000000000000000000000000000000000000000000000000000",
    "catalog_digest": "sha256:0000000000000000000000000000000000000000000000000000000000000000",
    "composition_digest": "sha256:0000000000000000000000000000000000000000000000000000000000000000",
    "support_matrix_digest": "sha256:0000000000000000000000000000000000000000000000000000000000000000"
  },
  "cases": []
}
